{
  "Version": 1,
  "ID": "59fa5f3c-6853-4e07-9fca-e0ab9257d9c1",
  "Song": {
    "Name": "Example Song",
    "Artist": "Example Artist",
    "Album": "Example Album",
    "Genre": "Rock",
    "Year": 2026,
    "AlbumTrack": 1,
    "Cover": false,
    "CoverArtist": "",
    "VocalGender": ""
  },
  "Chart": { "Author": "Example Author", "PreviewStart": 0, "PreviewEnd": 30 },
  "Difficulty": {
    "Band": 0,
    "LeadGuitar": 0,
    "BassGuitar": 0,
    "Drums": 0,
    "ProDrums": 0,
    "Vocals": 0,
    "Harmony": 0
  },
  "Credits": { "Publisher": "", "Writer": "" }
}
